rank,title,total_score,fit_score,job_score,location,job_category,score_reason,url,description,qualifications,working_condition,ai_summary,python_related,ai_related
18,Product Security Engineer (Infrastructure),43,0,43,Hybrid,Security,求人属性: Securityカテゴリ、ハイブリッド勤務、情報量が豊富。マッチ度: 勤務地条件がやや不一致。,https://job-boards.greenhouse.io/paypay/jobs/5700931004,"The PayPay Product Security team is looking for experienced infrastructure security engineers to lead improvements to our infrastructure and operational security, and introduce key security solutions.
PayPay Product Security team is responsible for driving the application security and infrastructure security changes within the product division - the part of PayPay responsible for development and operations of the PayPay app. A strong candidate for the infrastructure security engineer position will be knowledgeable about modern infrastructure solutions (such as Kubernetes, various public clouds and their services, message brokers and so on), security challenges and threats relevant to them, and have experience in one of the following areas:
Leading projects to improve infrastructure security at scale (e.g. introducing role-based access control, hardening K8s configurations, introducing temporary access credentials for database access, and so on) Introducing and improving security orchestration and automation, as well as solution to gather, store and analyze security events and assets","2+ years of infrastructure security or relevant experience Solid understanding of security principles, protocols, and best practices Solid programming skills in one or more programming languages, such as Java, Python, Golang Experience leading projects in any kind of security solutions, such as CNAPP, PAM, IDS/IPS, SIEM, SOAR, WAF, NGFW, etc Hands-on experience with cloud platforms, preferably AWS Hands-on Terraform experience. Experience with other IAC tools is also acceptable Hands-on experience with CI/CD pipelines and tools like Github Action, Jenkins, ArgoCD, etc Strong teamwork skills and the ability to collaborate with others in a diverse environment Enjoy taking up a challenge and driving it to a conclusion",,PayPayのプロダクトセキュリティチームでは、インフラセキュリティエンジニアを募集しています。応募者は、Kubernetesやクラウドサービスに関する知識と、セキュリティプロジェクトのリーダーシップ経験が必要です。2年以上のインフラセキュリティ経験とプログラミングスキルが求められ、ハイブリッド勤務が可能です。,Yes,No
19,システム基盤構築・自動化推進担当（AI活用推進）,43,0,43,Hybrid,Infra/SRE,求人属性: Infra/SREカテゴリ、AI関連、ハイブリッド勤務。マッチ度: 勤務地条件がやや不一致。,https://job-boards.greenhouse.io/paypay/jobs/5704642004,,,,システム基盤構築・自動化推進担当として、AI活用を推進する業務を行います。勤務地はハイブリッドで、応募要件や勤務条件の詳細は記載されていません。興味のある方は、具体的な情報を確認することをお勧めします。,No,Yes
20,SMB向け加盟店サービスのグロース・AI推進リード,35,0,35,Hybrid,Product,求人属性: Productカテゴリ、AI関連、ハイブリッド勤務。マッチ度: 勤務地条件がやや不一致。,https://job-boards.greenhouse.io/paypay/jobs/5681483004,,,,SMB向け加盟店サービスのグロースとAI推進を担当するリード職の求人です。勤務地はハイブリッドで、応募要件や勤務条件の詳細は記載されていません。興味のある方は、具体的な条件を確認の上応募を検討してください。,No,Yes
21,業務変革・プロジェクト推進担当（AI活用推進）,35,0,35,Hybrid,Product,求人属性: Productカテゴリ、AI関連、ハイブリッド勤務。マッチ度: 勤務地条件がやや不一致。,https://job-boards.greenhouse.io/paypay/jobs/5704640004,,,,業務変革・プロジェクト推進担当としてAI活用を推進するポジションで、勤務地はハイブリッドです。応募要件や勤務条件は記載されていませんが、プロジェクト推進に関心のある方に適しています。興味のある方は詳細を確認してください。,No,Yes
22,Frontend Engineer,32,0,32,Hybrid,Frontend,求人属性: Frontendカテゴリ、ハイブリッド勤務、情報量が十分。マッチ度: 勤務地条件がやや不一致。,https://job-boards.greenhouse.io/paypay/jobs/4089251004,"We are looking for a web frontend engineer to join PayPay. You will be building features that change how people in Japan use and manage their finances and business. As a fast-paced company leading the payments industry, we need our engineers to be versatile and enthusiastic to take on new challenges in order to stay at the forefront.",,,PayPayでは、ウェブフロントエンドエンジニアを募集しています。日本の金融やビジネスの管理方法を変える機能を開発する役割で、柔軟性と新しい挑戦への意欲が求められます。勤務地はハイブリッドで、急成長中の決済業界での活躍が期待されます。,No,No
23,データガバナンス推進,32,0,32,Hybrid,Data,求人属性: Dataカテゴリ、ハイブリッド勤務。マッチ度: 勤務地条件がやや不一致。,https://job-boards.greenhouse.io/paypay/jobs/5818516004,,,,データガバナンス推進の職種で、勤務地はハイブリッド（リモートとオフィスの併用）です。応募要件や具体的な仕事内容は記載されていませんが、データ管理に関する知識や経験が求められる可能性があります。勤務条件についての詳細も不明ですが、柔軟な働き方が期待されます。,No,No
24,Backend Engineer / バックエンドエンジニア (New Bank Project),30,0,30,Hybrid,Backend,求人属性: Backendカテゴリ、ハイブリッド勤務。マッチ度: 勤務地条件がやや不一致。,https://job-boards.greenhouse.io/paypay/jobs/5587090004,,,,新しい銀行プロジェクトのバックエンドエンジニアを募集しています。勤務地はハイブリッドで、応募要件や具体的な仕事内容は記載されていません。詳細な勤務条件については、応募時に確認が必要です。,No,No
25,CSシステム企画（業務変革推進担当/ボイス・テキスト担当）,30,0,30,Hybrid,Other,求人属性: Otherカテゴリ、AI関連、ハイブリッド勤務。マッチ度: 勤務地条件がやや不一致。,https://job-boards.greenhouse.io/paypay/jobs/5683465004,,,,CSシステム企画の業務変革推進担当として、ボイス・テキスト関連の業務を担当します。勤務地はハイブリッドで、応募要件や勤務条件は詳細に記載されていません。興味のある方は、具体的な条件を確認の上で応募を検討してください。,No,Yes
26,CSIRTエンジニア,28,0,28,Hybrid,Security,求人属性: Securityカテゴリ、ハイブリッド勤務。マッチ度: 勤務地条件がやや不一致。,https://job-boards.greenhouse.io/paypay/jobs/5193265004,,,,CSIRTエンジニアの求人で、勤務地はハイブリッド勤務です。具体的な仕事内容や応募要件は記載されていませんが、サイバーセキュリティに関する専門知識が求められる可能性があります。勤務条件の詳細は不明ですが、柔軟な働き方が期待されます。,No,No
27,セキュリティモニタリング,28,0,28,Hybrid,Security,求人属性: Securityカテゴリ、ハイブリッド勤務。マッチ度: 勤務地条件がやや不一致。,https://job-boards.greenhouse.io/paypay/jobs/5214187004,,,,セキュリティモニタリングの職種で、勤務地はハイブリッド（リモートとオフィスの併用）です。具体的な仕事内容や応募要件は記載されていませんが、セキュリティ関連の経験が求められる可能性があります。勤務条件についても詳細は不明ですが、柔軟な働き方が期待されます。,No,No
28,セキュリティマネジメント（セキュリティ推進）,28,0,28,Hybrid,Security,求人属性: Securityカテゴリ、ハイブリッド勤務。マッチ度: 勤務地条件がやや不一致。,https://job-boards.greenhouse.io/paypay/jobs/5818643004,,,,セキュリティマネジメント職の求人で、勤務地はハイブリッド勤務です。セキュリティ推進に関する業務を担当し、応募要件や勤務条件は詳細未記載です。興味のある方は、具体的な情報を確認することをお勧めします。,No,No
29,決済ソリューション企画・推進リード,20,0,20,Hybrid,Product,求人属性: Productカテゴリ、ハイブリッド勤務。マッチ度: 勤務地条件がやや不一致。,https://job-boards.greenhouse.io/paypay/jobs/5681480004,,,,決済ソリューション企画・推進リードのポジションで、ハイブリッド勤務が可能です。応募要件や具体的な仕事内容は記載されていませんが、決済関連の企画や推進に関わる役割です。興味がある方は詳細を確認してください。,No,No
30,新規事業開発・サービス企画 / リーダー候補（決済・資金移動サービス）,20,0,20,Hybrid,Product,求人属性: Productカテゴリ、ハイブリッド勤務。マッチ度: 勤務地条件がやや不一致。,https://job-boards.greenhouse.io/paypay/jobs/5681486004,,,,新規事業開発・サービス企画のリーダー候補を募集しています。勤務地はハイブリッドで、決済や資金移動サービスに関する経験が求められます。応募者にはリーダーシップと戦略的思考が期待されます。,No,No
31,新規事業開発・サービス企画 / リーダー候補（メーカー向け販促サービス）,20,0,20,Hybrid,Product,求人属性: Productカテゴリ、ハイブリッド勤務。マッチ度: 勤務地条件がやや不一致。,https://job-boards.greenhouse.io/paypay/jobs/5681489004,,,,新規事業開発・サービス企画のリーダー候補を募集しており、勤務地はハイブリッドです。メーカー向けの販促サービスに関わる業務を担当します。応募要件や勤務条件の詳細は記載されていません。,No,No
32,Product Manager / プロダクトマネージャー (New Bank Project),20,0,20,Hybrid,Product,求人属性: Productカテゴリ、ハイブリッド勤務。マッチ度: 勤務地条件がやや不一致。,https://job-boards.greenhouse.io/paypay/jobs/5733829004,,,,新しい銀行プロジェクトのプロダクトマネージャーを募集しています。勤務地はハイブリッドで、応募要件や勤務条件の詳細は記載されていません。興味のある方はぜひご応募ください。,No,No
33,マーケティング推進（プロダクトマーケティング/CRM施策推進）,20,0,20,Hybrid,Product,求人属性: Productカテゴリ、ハイブリッド勤務。マッチ度: 勤務地条件がやや不一致。,https://job-boards.greenhouse.io/paypay/jobs/5782672004,,,,マーケティング推進職（プロダクトマーケティングおよびCRM施策推進）を募集しています。勤務地はハイブリッドで、具体的な仕事内容や応募要件は記載されていません。勤務条件についての詳細も不明ですが、興味のある方は応募を検討してください。,No,No
34,エンタープライズ営業担当,15,0,15,Hybrid,Other,求人属性: Otherカテゴリ、ハイブリッド勤務。マッチ度: 勤務地条件がやや不一致。,https://job-boards.greenhouse.io/paypay/jobs/4089245004,,,,エンタープライズ営業担当の求人で、勤務地はハイブリッド勤務です。応募要件や具体的な仕事内容は記載されていませんが、営業経験が求められる可能性があります。勤務条件についての詳細は不明です。,No,No
35,IT統制担当/IT Controller,15,0,15,Hybrid,Other,求人属性: Otherカテゴリ、ハイブリッド勤務。マッチ度: 勤務地条件がやや不一致。,https://job-boards.greenhouse.io/paypay/jobs/4089304004,,,,IT統制担当（IT Controller）の求人です。勤務地はハイブリッドで、IT統制に関する業務を担当します。応募要件や勤務条件は記載されていませんが、IT関連の知識や経験が求められる可能性があります。,No,No
36,ポイントソリューション営業担当,15,0,15,Hybrid,Other,求人属性: Otherカテゴリ、ハイブリッド勤務。マッチ度: 勤務地条件がやや不一致。,https://job-boards.greenhouse.io/paypay/jobs/4726951004,,,,ポイントソリューション営業担当の求人で、勤務地はハイブリッド（リモートとオフィスの併用）です。応募要件や具体的な仕事内容は記載されていませんが、営業経験が求められる可能性があります。勤務条件についての詳細は不明です。,No,No
37,パートナー営業担当,15,0,15,Hybrid,Other,求人属性: Otherカテゴリ、ハイブリッド勤務。マッチ度: 勤務地条件がやや不一致。,https://job-boards.greenhouse.io/paypay/jobs/5477375004,,,,パートナー営業担当の求人で、勤務地はハイブリッド勤務です。具体的な仕事内容や応募要件は記載されていませんが、営業経験が求められる可能性があります。勤務条件についての詳細も不明ですが、柔軟な働き方が期待されます。,No,No
38,個店・SMB営業支援担当（販売戦略・企画推進）,15,0,15,Hybrid,Other,求人属性: Otherカテゴリ、ハイブリッド勤務。マッチ度: 勤務地条件がやや不一致。,https://job-boards.greenhouse.io/paypay/jobs/5504316004,,,,個店・SMB営業支援担当として、販売戦略や企画推進を行うポジションです。勤務地はハイブリッドで、柔軟な働き方が可能です。応募要件や勤務条件の詳細は記載されていません。,No,No
39,金融事業開発担当（銀行領域）,15,0,15,Hybrid,Other,求人属性: Otherカテゴリ、ハイブリッド勤務。マッチ度: 勤務地条件がやや不一致。,https://job-boards.greenhouse.io/paypay/jobs/5530875004,,,,金融事業開発担当（銀行領域）のポジションで、勤務地はハイブリッド勤務です。具体的な仕事内容や応募要件は記載されていませんが、金融業界での経験が求められる可能性があります。勤務条件についての詳細は不明ですが、柔軟な働き方が期待されます。,No,No
40,新規事業企画・戦略／リーダー候補（チャージ関連業務・金融機関連携）,15,0,15,Hybrid,Other,求人属性: Otherカテゴリ、ハイブリッド勤務。マッチ度: 勤務地条件がやや不一致。,https://job-boards.greenhouse.io/paypay/jobs/5636632004,,,,新規事業企画・戦略のリーダー候補を募集しており、チャージ関連業務や金融機関との連携が主な業務です。勤務地はハイブリッド勤務で、柔軟な働き方が可能です。応募要件や勤務条件の詳細は記載されていません。,No,No
41,金融事業開発・新規事業企画（保険）,15,0,15,Hybrid,Other,求人属性: Otherカテゴリ、ハイブリッド勤務。マッチ度: 勤務地条件がやや不一致。,https://job-boards.greenhouse.io/paypay/jobs/5643353004,,,,金融事業開発・新規事業企画のポジションで、保険業界における新規事業の立ち上げを担当します。勤務地はハイブリッド勤務で、応募要件や勤務条件は詳細に記載されていません。興味のある方は、具体的な条件を確認の上応募を検討してください。,No,No
42,System PMO,15,0,15,Hybrid,Other,求人属性: Otherカテゴリ、ハイブリッド勤務。マッチ度: 勤務地条件がやや不一致。,https://job-boards.greenhouse.io/paypay/jobs/5661282004,,,,職種はSystem PMOで、勤務地はハイブリッドです。具体的な仕事内容や応募要件は記載されていませんが、プロジェクト管理やシステム関連の経験が求められる可能性があります。勤務条件についての詳細は不明です。,No,No
43,マーケティング推進担当（Fintech事業）,15,0,15,Hybrid,Other,求人属性: Otherカテゴリ、ハイブリッド勤務。マッチ度: 勤務地条件がやや不一致。,https://job-boards.greenhouse.io/paypay/jobs/5674900004,,,,マーケティング推進担当としてFintech事業に携わるポジションで、勤務地はハイブリッド勤務です。具体的な仕事内容や応募要件は記載されていませんが、マーケティングに関連するスキルが求められる可能性があります。勤務条件についての詳細は不明です。,No,No
44,グローバルアライアンス・事業推進,15,0,15,Hybrid,Other,求人属性: Otherカテゴリ、ハイブリッド勤務。マッチ度: 勤務地条件がやや不一致。,https://job-boards.greenhouse.io/paypay/jobs/5675108004,,,,グローバルアライアンス・事業推進の職種で、勤務地はハイブリッド勤務です。具体的な仕事内容や応募要件は記載されていませんが、国際的なビジネス推進に関与する役割です。勤務条件についての詳細も不明ですが、柔軟な働き方が期待されます。,No,No
45,営業企画（戦略立案/企画推進担当）,15,0,15,Hybrid,Other,求人属性: Otherカテゴリ、ハイブリッド勤務。マッチ度: 勤務地条件がやや不一致。,https://job-boards.greenhouse.io/paypay/jobs/5677616004,,,,営業企画のポジションで、戦略立案や企画推進を担当します。勤務地はハイブリッドで、柔軟な働き方が可能です。応募要件や勤務条件の詳細は記載されていませんが、戦略的思考と企画力が求められます。,No,No
46,戦略推進（マーケティングオペレーションスペシャリスト）,15,0,15,Hybrid,Other,求人属性: Otherカテゴリ、ハイブリッド勤務。マッチ度: 勤務地条件がやや不一致。,https://job-boards.greenhouse.io/paypay/jobs/5677623004,,,,戦略推進（マーケティングオペレーションスペシャリスト）の求人で、勤務地はハイブリッドです。応募者はマーケティングに関する専門知識と経験が求められます。勤務条件についての詳細は記載されていません。,No,No
47,CS業務企画（業務変革推進担当）,15,0,15,Hybrid,Other,求人属性: Otherカテゴリ、ハイブリッド勤務。マッチ度: 勤務地条件がやや不一致。,https://job-boards.greenhouse.io/paypay/jobs/5681496004,,,,CS業務企画（業務変革推進担当）のポジションで、勤務地はハイブリッドです。業務改善や変革を推進する役割を担い、応募要件や勤務条件は記載されていません。興味のある方は詳細を確認してください。,No,No
48,事業戦略・事業企画 / リーダー候補,15,0,15,Hybrid,Other,求人属性: Otherカテゴリ、ハイブリッド勤務。マッチ度: 勤務地条件がやや不一致。,https://job-boards.greenhouse.io/paypay/jobs/5686546004,,,,事業戦略・事業企画のリーダー候補を募集しており、勤務地はハイブリッドです。具体的な仕事内容や応募要件は記載されていませんが、戦略的思考とリーダーシップが求められるポジションです。勤務条件についての詳細は不明ですが、柔軟な働き方が可能です。,No,No
49,新規事業開発・サービス企画 / 部長候補,15,0,15,Hybrid,Other,求人属性: Otherカテゴリ、ハイブリッド勤務。マッチ度: 勤務地条件がやや不一致。,https://job-boards.greenhouse.io/paypay/jobs/5686555004,,,,新規事業開発・サービス企画の部長候補を募集しています。勤務地はハイブリッドで、具体的な仕事内容や応募要件は記載されていません。興味のある方は詳細を確認の上、応募を検討してください。,No,No
50,マーケティング戦略推進,15,0,15,Hybrid,Other,求人属性: Otherカテゴリ、ハイブリッド勤務。マッチ度: 勤務地条件がやや不一致。,https://job-boards.greenhouse.io/paypay/jobs/5718915004,,,,マーケティング戦略推進の職種で、勤務地はハイブリッド勤務です。応募要件や具体的な仕事内容は記載されていませんが、マーケティングに関する戦略の立案や実行が求められる可能性があります。勤務条件についての詳細も不明ですが、柔軟な働き方が期待されます。,No,No
51,営業支援担当（営業管理・統制推進）,15,0,15,Hybrid,Other,求人属性: Otherカテゴリ、ハイブリッド勤務。マッチ度: 勤務地条件がやや不一致。,https://job-boards.greenhouse.io/paypay/jobs/5725803004,,,,営業支援担当として、営業管理や統制推進を行うポジションです。勤務地はハイブリッドで、柔軟な働き方が可能です。応募要件や勤務条件の詳細は記載されていませんが、営業関連の経験が求められる可能性があります。,No,No
52,資産運用事業戦略企画（リーダー候補）,15,0,15,Hybrid,Other,求人属性: Otherカテゴリ、ハイブリッド勤務。マッチ度: 勤務地条件がやや不一致。,https://job-boards.greenhouse.io/paypay/jobs/5765333004,,,,資産運用事業戦略企画のリーダー候補を募集しています。勤務地はハイブリッドで、戦略立案や実行に関わる業務を担当します。応募要件や勤務条件は詳細に記載されており、経験者を歓迎します。,No,No
53,,5,0,5,,Other,求人属性: Otherカテゴリ。マッチ度: 勤務地条件がやや不一致。,https://job-boards.greenhouse.io/paypay/jobs/4643779004,,,,申し訳ありませんが、具体的な求人情報が提供されていないため、要約を作成することができません。求人情報の詳細を教えていただければ、要約をお手伝いします。,No,No
54,,5,0,5,,Other,求人属性: Otherカテゴリ。マッチ度: 勤務地条件がやや不一致。,https://job-boards.greenhouse.io/paypay/jobs/5501932004,,,,職種名、勤務地、仕事内容、応募要件、勤務条件の具体的な情報が提供されていないため、要約を作成することができません。これらの情報を提供していただければ、要約を作成いたします。,No,No
