url,title,location,description,qualifications,working_condition,ai_summary
https://job-boards.greenhouse.io/paypay/jobs/4089245004,エンタープライズ営業担当,Hybrid,,,,エンタープライズ営業担当を募集しており、勤務地はハイブリッド勤務です。応募要件や具体的な仕事内容は記載されていませんが、営業経験が求められる可能性があります。勤務条件についての詳細は不明です。
https://job-boards.greenhouse.io/paypay/jobs/4089251004,Frontend Engineer,Hybrid,"We are looking for a web frontend engineer to join PayPay. You will be building features that change how people in Japan use and manage their finances and business. As a fast-paced company leading the payments industry, we need our engineers to be versatile and enthusiastic to take on new challenges in order to stay at the forefront.",,,PayPayでは、ハイブリッド勤務のフロントエンドエンジニアを募集しています。日本の金融やビジネスの管理方法を変える機能を開発する役割で、迅速な変化に対応できる柔軟性と意欲が求められます。応募要件や勤務条件の詳細は記載されていません。
https://job-boards.greenhouse.io/paypay/jobs/4089265004,Data Engineer (DaaS),Hybrid,"PayPay's rapid growth necessitates the expansion of its product teams and underscores the critical need for a resilient Data Engineering Platform. This platform is vital to support our increasing business demands. The Data Pipeline team is tasked with creating, deploying, and managing this platform, utilizing leading technologies like Databricks, Delta Lake, Spark, Scala, and the AWS suite.
We are actively seeking skilled Data Engineers to join our team and contribute to scaling our platform across the organization.","Minimum 7 years as a Data Engineer or similar role. Hands-on experience with Databricks, Snowflake, Delta Lake, Spark, and Scala. Proven ability to design, build, and operate Data Lakes or Data Warehouses. Proficiency with Data Orchestration tools (Airflow, Dagster, Prefect). Familiarity with Change Data Capture tools (Canal, Debezium, Maxwell). Strong command of at least one primary language (Scala, Python, etc.) and SQL. Experience with data catalog and metadata management (Unity Catalog, Lakeformation). Experience in Infrastructure as Code (IaC) using Terraform. Excellent problem-solving and debugging abilities for complex data challenges. Strong communication and collaboration skills. Capability to make informed decisions, learn quickly, and consider complex technical contexts.",,PayPayでは、データエンジニアリングプラットフォームの拡張に伴い、データエンジニアを募集しています。応募者は、7年以上の関連経験とDatabricksやSparkなどの技術に精通している必要があります。ハイブリッド勤務で、複雑なデータ課題を解決する能力やコミュニケーションスキルが求められます。
https://job-boards.greenhouse.io/paypay/jobs/4089300004,Site Reliability Engineer (Bilingual SRE),Hybrid,,"Experience troubleshooting, tuning high performance microservice architectures running on Kubernetes and AWS in highly available production environments. 5+ years experience in software development in Python, Java, Go, etc with strong fundamentals in data structures, algorithms, problem solving and complexity analysis. *During the selection process, you will have a coding challenge. Curious and proactive in finding performance bottlenecks, scalability and resilience problem areas and addressing them. Experience with observability tools and gathering data. Database knowledge such as RDS, NoSQL, distributed TiDB, etc. Excellent communication skills, collaborative and getting things done attitude. Enjoy taking up a challenge and driving it to conclusion. Ability to verbally communicate in both English and Japanese.",,Site Reliability Engineer (Bilingual SRE)のポジションで、ハイブリッド勤務が可能です。応募者は、KubernetesとAWSを使用した高可用性のマイクロサービスアーキテクチャのトラブルシューティング経験があり、Python、Java、Goなどで5年以上のソフトウェア開発経験が求められます。英語と日本語でのコミュニケーション能力が必要で、パフォーマンスのボトルネックやスケーラビリティの問題を解決する意欲が求められます。
https://job-boards.greenhouse.io/paypay/jobs/4089304004,IT統制担当/IT Controller,Hybrid,,,,IT統制担当（IT Controller）のポジションで、勤務地はハイブリッド勤務です。応募要件や具体的な仕事内容は記載されていませんが、IT関連の統制業務に関わる役割です。興味のある方は詳細を確認の上、応募を検討してください。
https://job-boards.greenhouse.io/paypay/jobs/4090172004,Automation QA Engineer,Hybrid,,"Minimum 3+ years of experience in developing, executing, and maintaining automated test cases for mobile applications, web applications, and/or APIs. Proven professional experience with at least one of the following automation frameworks/tools: Appium (for mobile), Selenium (for web), or Rest-Assured (for APIs). Proficient in utilizing Cucumber for defining and executing test cases. Well-versed in Continuous Integration/Continuous Deployment (CI/CD) tools such as Jenkins, Bitrise, or similar platforms. Basic understanding of microservices architecture and its associated testing challenges. Strong ability to analyze technical requirements, design comprehensive test strategies, and create detailed, effective test cases. Exceptional analytical and problem-solving skills, coupled with a meticulous attention to detail. Excellent communication skills, a team-oriented mindset, and the ability to work effectively both independently and collaboratively. Hands-on experience with AI productivity tools (NotebookLM, Gemini, Cursor AI, GitHub Copilot). Knowledge of OpenAI API usage, key management, embeddings, and LLM integration workflows. Familiarity with MCP server concepts and their integration in test automation pipelines. Understanding of AI system validation techniques, including testing for bias, hallucinations, drift, and robustness.",,Automation QA Engineerの求人で、ハイブリッド勤務が可能です。応募者は、モバイルやウェブアプリ、APIの自動テストケースの開発・実行・維持に3年以上の経験が必要で、Appium、Selenium、Rest-Assuredのいずれかのフレームワークに精通していることが求められます。また、CI/CDツールやAI関連のスキルも重視されます。
https://job-boards.greenhouse.io/paypay/jobs/4182995004,Product Designer / プロダクトデザイナー (UX/UI),Hybrid,,"More than 3-5 years of hands-on professional experience in mobile app (iOS/Android) UX/UI design. Experience in UX/UI design using Figma and Adobe Hands-on experience in product release, effectiveness measurement, and product improvement Business conversation level in Japanese or English Experience in using PayPay application",,プロダクトデザイナー（UX/UI）の求人で、勤務地はハイブリッドです。応募には、モバイルアプリのUX/UIデザインに3-5年の実務経験が必要で、FigmaやAdobeの使用経験、製品リリースや改善の実績が求められます。また、日本語または英語でのビジネス会話能力が必要です。
https://job-boards.greenhouse.io/paypay/jobs/4643779004,,,,,,職種名、勤務地、仕事内容、応募要件、勤務条件の情報が不足しているため、要約を作成できません。具体的な求人情報を提供していただければ、要約をお手伝いします。
https://job-boards.greenhouse.io/paypay/jobs/4726951004,ポイントソリューション営業担当,Hybrid,,,,ポイントソリューション営業担当として、ハイブリッド勤務での営業活動を行います。応募要件や具体的な仕事内容は記載されていませんが、営業経験が求められる可能性があります。勤務条件についての詳細は不明です。
https://job-boards.greenhouse.io/paypay/jobs/4888665004,Principal Software Engineer,Hybrid,"We are looking for a Principal Software Engineer to work on our various systems which need high scalability, reliability and availability. These challenges require creative thinking and a deep understanding of how software and platform work.
Our ideal candidate is an ace problem solver and a learner at heart. You should have a very high degree of comfort in a programming language of your choice. We offer a flexible work schedule and you get your choice of tools (both hardware and software) and most importantly, the opportunity to work on tough problems with the brightest minds around you. So, if challenges excite you, and you're ready for a big one, let us know.
Responsibilities:
Design, develop, test, deploy, maintain and improve software and core platform Lead technical aspects for multiple projects through hands-on execution and guidance of other engineers Provide architectural blueprints and technical leadership. Provides input and guidance during all phases of programs to solve challenging technical issues. Build common platforms to support different business vertical application systems Develop tools and contribute to open source wherever possible Adopt problem-solving as a way of life – always go to the root cause!
Experience:
Solid foundation in designing, implementing, and maintaining a large-scale distributed system. Experience in developing distributed platform systems such as Messaging Platforms, Pub/Sub Systems, Databases, Distributed Computing Frameworks, and Schedulers.
Tech Stack:
Our technology stack may vary based on project needs. Currently, we utilize:
Programming Languages: Java, Kotlin, Scala Frameworks and Tools: Spring Boot, JUnit, Resilience4j, Feign Databases: MySQL/AuroraDB, DynamoDB, ELK, Kafka, Redis, TiDB Deployment and Orchestration: Docker, Kubernetes, ArgoCD, AWS, GCP Development Tools: GitHub, IntelliJ, Gradle, Maven, npm/yarn, Flyway, Jenkins Data Analytics: BigQuery, Kibana, Spark Diagramming Tools: PlantUML, draw.io , miro.com Communication: Slack, Zoom
Qualifications:
Degree in Computer Engineering or Computer Science or 7+ years equivalent experience in software development Strong fundamentals in data structure, algorithm, operating system and object-oriented programming Deep understanding of concurrency, distributed computing, large-scale system, messaging and algorithm Software development experience in one or more general-purpose programming languages Interest and ability to learn new technology stacks as needed
Preferred Qualifications:
Experience in working for system development in finance, payment, or similar industries Experience with AWS services Contribute to open-source projects Language ability in Japanese and English is a plus (We have a professional translator but it is nice to have language skills)
Portrait:
Experience: Demonstrated experience designing and implementing large scale, high performance, micro-service based architectures utilizing new concepts and technologies where appropriate. Ownership: A mentoring approach to owning, managing and improving the technical aspects of a large scale system end to end. Communication : The ability to clearly and logically communicate your choice of technology and architectural decision based on its implementation strengths and limitations. Commitment : As a professional, commit to the growth and business goals of the organization and create impactful results by your ownership. Curiosity: Foster a development culture that explores new ideas knowing that we learn even from the ones that fail.",,,ハイブリッド勤務のPrincipal Software Engineerを募集しています。大規模で信頼性の高いシステムの設計・開発・運用を担当し、技術的リーダーシップを発揮する役割です。7年以上のソフトウェア開発経験と、分散システムに関する深い理解が求められます。
https://job-boards.greenhouse.io/paypay/jobs/4918512004,Senior Data Science Engineer / Senior Machine Learning Engineer - Data Insights,Hybrid,"PayPay's growth is driving a rapid expansion of PayPay product teams, and the need for a robust data platform that drives cutting-edge data science and powers machine learning innovations is more critical than ever in order to support our growing business needs. We are looking for a Senior Data Science Engineer or Senior Machine Learning Engineer for the Data Insights department.",,,PayPayでは、データインサイト部門でシニアデータサイエンスエンジニアまたはシニアマシンラーニングエンジニアを募集しています。ハイブリッド勤務で、急成長するビジネスニーズに応えるためのデータプラットフォームの構築と機械学習の革新を推進する役割です。応募要件は記載されていませんが、データサイエンスや機械学習の専門知識が求められます。
https://job-boards.greenhouse.io/paypay/jobs/4919371004,Cloud Platform Engineer (DB Specialist),Hybrid,"We are working to provide the best financial services to users in Japan. We empower PayPay product by realizing efficient, stable and optimized storage services. PayPay is looking for Cloud Platform Engineers who specialize in databases at scale on mission critical systems.
Main Responsibilities
Database operations, including monitoring, configuration management, upgrade, scaling, backup, and data migration. Iterate on database operations to improve quality and efficiency Troubleshoot stability and performance problems Contribute to documentation for communicating knowledge, experience and for effective decision-making Research and test new tools in database ecosystems, and adopt them in PayPay Group.","More than 5 years of DBA experience with a minimum of 3 years MySQL or PostgreSQL experience. More than 3 years of AWS experience in recent years Hands-on experience with Infra as Code (IaC - terraform) Interested in new technologies and willing to improve operational quality and efficiency Familiar with shell and programming language for scripting(Python, Go,...)",,PayPayでは、データベースに特化したCloud Platform Engineerを募集しています。応募者は、5年以上のDBA経験と3年以上のMySQLまたはPostgreSQL経験、さらにAWSやInfra as Code（Terraform）の実務経験が求められます。勤務地はハイブリッドで、データベースの運用や新技術の研究・導入に関わる業務を担当します。
https://job-boards.greenhouse.io/paypay/jobs/5149320004,シニア機械学習エンジニア（金融事業領域）,Hybrid,,,,シニア機械学習エンジニアを募集しており、金融事業領域での経験が求められます。勤務地はハイブリッド勤務で、応募要件や勤務条件の詳細は記載されていません。機械学習の専門知識を活かしたい方に適したポジションです。
https://job-boards.greenhouse.io/paypay/jobs/5193265004,CSIRTエンジニア,Hybrid,,,,CSIRTエンジニアの求人で、勤務地はハイブリッドです。具体的な仕事内容や応募要件は記載されていませんが、サイバーセキュリティに関する知識や経験が求められる可能性があります。勤務条件についての詳細も不明です。
https://job-boards.greenhouse.io/paypay/jobs/5214187004,セキュリティモニタリング,Hybrid,,,,セキュリティモニタリングの職種で、勤務地はハイブリッド勤務です。応募要件や勤務条件は記載されていませんが、セキュリティ関連の経験が求められる可能性があります。興味のある方は詳細を確認してください。
https://job-boards.greenhouse.io/paypay/jobs/5471535004,Cloud Platform Engineer,Hybrid,"PayPay is looking for a Cloud Platform Engineer for PayPay's Cloud Based payment system. This role will be responsible for the engineering of Cloud Infrastructure Platforms to provide robust, reliable and cost-efficient Platform so that we can deliver the best experience for our growing customers base.","More than 5 years of technical and architectural experience in AWS-based infrastructure platforms Extensive technical hands-on experience with computing, networking, storage, and analytical services on Latest AWS Services Experience with Terraform based infrastructure as code (IAC) on AWS Experience in production level infrastructure change management and releases for high traffic & business-critical systems Experience in Cloud infrastructure and platform systems availability, performance and cost management Experience as an AWS administrator, including Multi AWS organization management, managing 50+ AWS accounts and 100+ users Strong understanding of cloud security best practices in Fintech Industry Demonstrated skill in programming and scripting languages, including Python, Shell Scripting, Go, and Rust Excellent oral, written, and interpersonal communication skills Proficiency in either English or Japanese",,PayPayでは、クラウドベースの決済システムのためのCloud Platform Engineerを募集しています。応募者は、AWSインフラプラットフォームでの5年以上の技術経験や、Terraformを用いたインフラ管理の経験が求められます。また、クラウドセキュリティの知識やプログラミングスキルも必要です。勤務地はハイブリッドです。
https://job-boards.greenhouse.io/paypay/jobs/5477375004,パートナー営業担当,Hybrid,,,,パートナー営業担当の求人で、勤務地はハイブリッド勤務です。具体的な仕事内容や応募要件は記載されていませんが、営業経験が求められる可能性があります。勤務条件についての詳細も不明です。
https://job-boards.greenhouse.io/paypay/jobs/5501932004,,,,,,職種名、勤務地、仕事内容、応募要件、勤務条件の具体的な情報が提供されていないため、要約を作成することができません。これらの詳細を教えていただければ、要約をお手伝いできます。
https://job-boards.greenhouse.io/paypay/jobs/5504316004,個店・SMB営業支援担当（販売戦略・企画推進）,Hybrid,,,,個店・SMB営業支援担当として、販売戦略や企画推進を行うポジションです。勤務地はハイブリッドで、柔軟な働き方が可能です。応募要件や勤務条件の詳細は記載されていませんが、営業支援に関する経験が求められる可能性があります。
https://job-boards.greenhouse.io/paypay/jobs/5504319004,営業支援担当（数値分析・運用推進）,Hybrid,,,,営業支援担当として、数値分析や運用推進を行うポジションです。勤務地はハイブリッドで、柔軟な働き方が可能です。応募要件や勤務条件は詳細に記載されていないため、確認が必要です。
https://job-boards.greenhouse.io/paypay/jobs/5530875004,金融事業開発担当（銀行領域）,Hybrid,,,,金融事業開発担当（銀行領域）のポジションで、勤務地はハイブリッドです。応募要件や勤務条件の詳細は記載されていませんが、金融業界での経験やスキルが求められる可能性があります。興味のある方は、具体的な情報を確認の上で応募を検討してください。
https://job-boards.greenhouse.io/paypay/jobs/5570222004,Cloud Platform Engineer (Kafka Specialist),Hybrid,"At the core of our architecture in PayPay, we use Kafka for high-performance data streaming, and every payment that goes through the app is handled by multiple topics in Kafka. To keep up with the challenges of our growing product and future expansion, we are expanding our Streaming Platform team and are looking for an engineer with deep experience in Kafka to help lead the next stage.
The role involves strengthening our existing platform to bring a truly event-driven architecture to our development process, while adding performance and resilience to the existing application. A key part of our current roadmap includes migrating our self-hosted Kafka clusters to KRaft mode and operating Kafka both in self-managed form and via AWS MSK. We are looking for someone who is not only hands-on with Kafka internals, but also confident operating it at scale in production environments.
This is a senior role but still very hands-on , an excellent opportunity to build and modernize the streaming infrastructure that powers payments for over 70 million users.","Minimum of 2 years of engineering experience with Apache Kafka in production environments Minimum of 2 years of experience in AWS, Terraform, Ansible and Linux Administration Strong hands-on experience with Kafka cluster operations, including setup, tuning, and maintenance Experience with Kafka authentication and authorization operations Familiarity with AWS cloud platform, especially Amazon MSK (Managed Streaming for Kafka) * We heavily rely on AWS, so those without previous AWS experiences must expect to catch up with it after joining us Proficiency in one or more general-purpose programming languages (e.g., Python, Java, Go) Experience with infrastructure automation and configuration management tools, such as Terraform or Ansible Understanding of modern system design using microservice architecture Working knowledge of Git and CI/CD tools Ability to take ownership, solve problems fast and operate proactively",,PayPayでは、Kafkaを用いた高性能データストリーミングを支えるCloud Platform Engineer (Kafka Specialist)を募集しています。応募者は、Kafkaの運用経験やAWS、Terraform、Ansibleに精通し、イベント駆動アーキテクチャの構築に貢献できることが求められます。ハイブリッド勤務で、70万人以上のユーザー向けのストリーミングインフラのモダナイゼーションに関与する機会があります。
https://job-boards.greenhouse.io/paypay/jobs/5587090004,Backend Engineer / バックエンドエンジニア (New Bank Project),Hybrid,,,,新しい銀行プロジェクトのバックエンドエンジニアを募集しています。勤務地はハイブリッドで、応募要件や勤務条件は詳細に記載されていません。興味のある方はぜひご応募ください。
https://job-boards.greenhouse.io/paypay/jobs/5636632004,新規事業企画・戦略／リーダー候補（チャージ関連業務・金融機関連携）,Hybrid,,,,新規事業企画・戦略のリーダー候補を募集しており、チャージ関連業務や金融機関との連携が主な業務です。勤務地はハイブリッド勤務で、応募要件や勤務条件の詳細は記載されていません。興味のある方は、具体的な条件を確認することをお勧めします。
https://job-boards.greenhouse.io/paypay/jobs/5643353004,金融事業開発・新規事業企画（保険）,Hybrid,,,,金融事業開発・新規事業企画のポジションで、保険業界における新規事業の企画・推進を担当します。勤務地はハイブリッド勤務で、応募要件や勤務条件は記載されていません。興味のある方は詳細を確認してください。
https://job-boards.greenhouse.io/paypay/jobs/5661282004,System PMO,Hybrid,,,,職種はSystem PMOで、勤務地はハイブリッド勤務です。具体的な仕事内容や応募要件は記載されていませんが、PMO関連の経験が求められる可能性があります。勤務条件の詳細も不明ですが、柔軟な働き方が期待されます。
https://job-boards.greenhouse.io/paypay/jobs/5674900004,マーケティング推進担当（Fintech事業）,Hybrid,,,,マーケティング推進担当（Fintech事業）の求人で、勤務地はハイブリッド勤務です。応募要件や具体的な仕事内容は記載されていませんが、マーケティングに関する経験が求められる可能性があります。興味のある方は詳細を確認することをお勧めします。
https://job-boards.greenhouse.io/paypay/jobs/5675108004,グローバルアライアンス・事業推進,Hybrid,,,,グローバルアライアンス・事業推進の職種で、勤務地はハイブリッド勤務です。具体的な仕事内容や応募要件は記載されていませんが、国際的なビジネス推進に関与する役割です。興味がある方は詳細を確認の上、応募を検討してください。
https://job-boards.greenhouse.io/paypay/jobs/5677616004,営業企画（戦略立案/企画推進担当）,Hybrid,,,,営業企画の戦略立案と企画推進を担当するポジションで、勤務地はハイブリッドです。応募要件や勤務条件の詳細は記載されていませんが、戦略的思考と企画力が求められます。興味のある方は、具体的な条件を確認の上応募してください。
